{
  "schema_version": 1,
  "upstream": {
    "name": "Ant Design",
    "version": "6.5.0",
    "tag": "6.5.0",
    "commit": "740ad964dc2397f33e40944367b0536a7314cc32",
    "repository": "https://github.com/ant-design/ant-design",
    "license": "MIT"
  },
  "document_sources": [
    {
      "identity": "ant.document.introduction",
      "title": "Introduction",
      "chinese_title": "介绍",
      "source_path": "docs/spec/introduce.en-US.md",
      "chinese_source_path": "docs/spec/introduce.zh-CN.md",
      "official_url": "https://ant.design/docs/spec/introduce"
    },
    {
      "identity": "ant.document.design-values",
      "title": "Design Values",
      "chinese_title": "设计价值观",
      "source_path": "docs/spec/values.en-US.md",
      "chinese_source_path": "docs/spec/values.zh-CN.md",
      "official_url": "https://ant.design/docs/spec/values"
    },
    {
      "identity": "ant.document.resources",
      "title": "Resources",
      "chinese_title": "设计资源",
      "source_path": "docs/resources.en-US.md",
      "chinese_source_path": "docs/resources.zh-CN.md",
      "official_url": "https://ant.design/docs/resources"
    },
    {
      "identity": "ant.document.components-overview",
      "title": "Components Overview",
      "chinese_title": "组件总览",
      "source_path": "components/overview/index.en-US.md",
      "chinese_source_path": "components/overview/index.zh-CN.md",
      "renderer_source_path": ".dumi/theme/builtins/ComponentOverview/index.tsx",
      "official_url": "https://ant.design/components/overview/"
    }
  ],
  "category_order": [
    "General",
    "Layout",
    "Navigation",
    "Data Entry",
    "Data Display",
    "Feedback",
    "Other"
  ],
  "categories": [
    {
      "identity": "ant.category.general",
      "name": "General",
      "chinese_name": "通用",
      "order": 0,
      "expected_count": 4,
      "components": [
        {
          "identity": "ant.component.button",
          "english_name": "Button",
          "chinese_name": "按钮",
          "order": 0,
          "source_path": "components/button/index.en-US.md",
          "chinese_source_path": "components/button/index.zh-CN.md"
        },
        {
          "identity": "ant.component.float-button",
          "english_name": "FloatButton",
          "chinese_name": "悬浮按钮",
          "order": 1,
          "source_path": "components/float-button/index.en-US.md",
          "chinese_source_path": "components/float-button/index.zh-CN.md"
        },
        {
          "identity": "ant.component.icon",
          "english_name": "Icon",
          "chinese_name": "图标",
          "order": 2,
          "source_path": "components/icon/index.en-US.md",
          "chinese_source_path": "components/icon/index.zh-CN.md"
        },
        {
          "identity": "ant.component.typography",
          "english_name": "Typography",
          "chinese_name": "排版",
          "order": 3,
          "source_path": "components/typography/index.en-US.md",
          "chinese_source_path": "components/typography/index.zh-CN.md"
        }
      ]
    },
    {
      "identity": "ant.category.layout",
      "name": "Layout",
      "chinese_name": "布局",
      "order": 1,
      "expected_count": 7,
      "components": [
        {
          "identity": "ant.component.divider",
          "english_name": "Divider",
          "chinese_name": "分割线",
          "order": 0,
          "source_path": "components/divider/index.en-US.md",
          "chinese_source_path": "components/divider/index.zh-CN.md"
        },
        {
          "identity": "ant.component.flex",
          "english_name": "Flex",
          "chinese_name": "弹性布局",
          "order": 1,
          "source_path": "components/flex/index.en-US.md",
          "chinese_source_path": "components/flex/index.zh-CN.md"
        },
        {
          "identity": "ant.component.grid",
          "english_name": "Grid",
          "chinese_name": "栅格",
          "order": 2,
          "source_path": "components/grid/index.en-US.md",
          "chinese_source_path": "components/grid/index.zh-CN.md"
        },
        {
          "identity": "ant.component.layout",
          "english_name": "Layout",
          "chinese_name": "布局",
          "order": 3,
          "source_path": "components/layout/index.en-US.md",
          "chinese_source_path": "components/layout/index.zh-CN.md"
        },
        {
          "identity": "ant.component.masonry",
          "english_name": "Masonry",
          "chinese_name": "瀑布流",
          "order": 4,
          "source_path": "components/masonry/index.en-US.md",
          "chinese_source_path": "components/masonry/index.zh-CN.md"
        },
        {
          "identity": "ant.component.space",
          "english_name": "Space",
          "chinese_name": "间距",
          "order": 5,
          "source_path": "components/space/index.en-US.md",
          "chinese_source_path": "components/space/index.zh-CN.md"
        },
        {
          "identity": "ant.component.splitter",
          "english_name": "Splitter",
          "chinese_name": "分隔面板",
          "order": 6,
          "source_path": "components/splitter/index.en-US.md",
          "chinese_source_path": "components/splitter/index.zh-CN.md"
        }
      ]
    },
    {
      "identity": "ant.category.navigation",
      "name": "Navigation",
      "chinese_name": "导航",
      "order": 2,
      "expected_count": 7,
      "components": [
        {
          "identity": "ant.component.anchor",
          "english_name": "Anchor",
          "chinese_name": "锚点",
          "order": 0,
          "source_path": "components/anchor/index.en-US.md",
          "chinese_source_path": "components/anchor/index.zh-CN.md"
        },
        {
          "identity": "ant.component.breadcrumb",
          "english_name": "Breadcrumb",
          "chinese_name": "面包屑",
          "order": 1,
          "source_path": "components/breadcrumb/index.en-US.md",
          "chinese_source_path": "components/breadcrumb/index.zh-CN.md"
        },
        {
          "identity": "ant.component.dropdown",
          "english_name": "Dropdown",
          "chinese_name": "下拉菜单",
          "order": 2,
          "source_path": "components/dropdown/index.en-US.md",
          "chinese_source_path": "components/dropdown/index.zh-CN.md"
        },
        {
          "identity": "ant.component.menu",
          "english_name": "Menu",
          "chinese_name": "导航菜单",
          "order": 3,
          "source_path": "components/menu/index.en-US.md",
          "chinese_source_path": "components/menu/index.zh-CN.md"
        },
        {
          "identity": "ant.component.pagination",
          "english_name": "Pagination",
          "chinese_name": "分页",
          "order": 4,
          "source_path": "components/pagination/index.en-US.md",
          "chinese_source_path": "components/pagination/index.zh-CN.md"
        },
        {
          "identity": "ant.component.steps",
          "english_name": "Steps",
          "chinese_name": "步骤条",
          "order": 5,
          "source_path": "components/steps/index.en-US.md",
          "chinese_source_path": "components/steps/index.zh-CN.md"
        },
        {
          "identity": "ant.component.tabs",
          "english_name": "Tabs",
          "chinese_name": "标签页",
          "order": 6,
          "source_path": "components/tabs/index.en-US.md",
          "chinese_source_path": "components/tabs/index.zh-CN.md"
        }
      ]
    },
    {
      "identity": "ant.category.data-entry",
      "name": "Data Entry",
      "chinese_name": "数据录入",
      "order": 3,
      "expected_count": 18,
      "components": [
        {
          "identity": "ant.component.auto-complete",
          "english_name": "AutoComplete",
          "chinese_name": "自动完成",
          "order": 0,
          "source_path": "components/auto-complete/index.en-US.md",
          "chinese_source_path": "components/auto-complete/index.zh-CN.md"
        },
        {
          "identity": "ant.component.cascader",
          "english_name": "Cascader",
          "chinese_name": "级联选择",
          "order": 1,
          "source_path": "components/cascader/index.en-US.md",
          "chinese_source_path": "components/cascader/index.zh-CN.md"
        },
        {
          "identity": "ant.component.checkbox",
          "english_name": "Checkbox",
          "chinese_name": "多选框",
          "order": 2,
          "source_path": "components/checkbox/index.en-US.md",
          "chinese_source_path": "components/checkbox/index.zh-CN.md"
        },
        {
          "identity": "ant.component.color-picker",
          "english_name": "ColorPicker",
          "chinese_name": "颜色选择器",
          "order": 3,
          "source_path": "components/color-picker/index.en-US.md",
          "chinese_source_path": "components/color-picker/index.zh-CN.md"
        },
        {
          "identity": "ant.component.date-picker",
          "english_name": "DatePicker",
          "chinese_name": "日期选择框",
          "order": 4,
          "source_path": "components/date-picker/index.en-US.md",
          "chinese_source_path": "components/date-picker/index.zh-CN.md"
        },
        {
          "identity": "ant.component.form",
          "english_name": "Form",
          "chinese_name": "表单",
          "order": 5,
          "source_path": "components/form/index.en-US.md",
          "chinese_source_path": "components/form/index.zh-CN.md"
        },
        {
          "identity": "ant.component.input",
          "english_name": "Input",
          "chinese_name": "输入框",
          "order": 6,
          "source_path": "components/input/index.en-US.md",
          "chinese_source_path": "components/input/index.zh-CN.md"
        },
        {
          "identity": "ant.component.input-number",
          "english_name": "InputNumber",
          "chinese_name": "数字输入框",
          "order": 7,
          "source_path": "components/input-number/index.en-US.md",